{
  "import_id": "tpdry_a5678ba9e856a763",
  "run_id": "run_preview_78eee6afcec1f12a",
  "workflow_id": "decision_brief_pack",
  "executor_result_id": "execdry_412861ba7acffd38",
  "generated_at": "2026-06-12T17:16:52Z",
  "dry_run_only": true,
  "taskpool_write_enabled": false,
  "taskpool_claim_enabled": false,
  "runtime_enabled": false,
  "model_call_enabled": false,
  "adapter_write_enabled": false,
  "external_side_effects_enabled": false,
  "candidate_tasks": [
    {
      "candidate_id": "candidate_005107060ee9",
      "source_step_id": "dry_step_001",
      "source_criterion": "workflow_contract_valid",
      "title": "Workflow dry-run candidate: workflow contract valid",
      "lane": "evolution",
      "priority": "P2",
      "status_candidate": "pending",
      "frontmatter_preview": {
        "status": "pending",
        "priority": "P2",
        "lane": "evolution",
        "project": "hermes",
        "architecture_target": "modular-workflow-kernel",
        "workflow_id": "decision_brief_pack",
        "workflow_run_id": "run_preview_78eee6afcec1f12a",
        "workflow_executor_result_id": "execdry_412861ba7acffd38",
        "workflow_import_dry_run_id": "tpdry_a5678ba9e856a763",
        "source_criterion": "workflow_contract_valid",
        "dry_run_candidate_only": true,
        "taskpool_write_enabled": false,
        "requires_human_gate": false
      },
      "body_preview": "# Workflow dry-run candidate: workflow contract valid\n\nThis is a taskpool import candidate generated from a workflow executor dry-run.\nIt is not a canonical brain task and must not be claimed until a separate taskpool import write gate is authorized.\n\n- Source step: `dry_step_001`\n- Source criterion: `workflow_contract_valid`\n- Boundary status: `candidate_pending`",
      "evidence": [
        "artifact:executor_dry_run:execdry_412861ba7acffd38",
        "proof:taskpool_import_dry_run_no_canonical_write",
        "classification:workflow_kernel_import_candidate"
      ],
      "write_enabled": false
    },
    {
      "candidate_id": "candidate_48f87b14c0a0",
      "source_step_id": "dry_step_002",
      "source_criterion": "runtime_disabled_in_phase1",
      "title": "Workflow dry-run candidate: runtime disabled in phase1",
      "lane": "evolution",
      "priority": "P2",
      "status_candidate": "pending",
      "frontmatter_preview": {
        "status": "pending",
        "priority": "P2",
        "lane": "evolution",
        "project": "hermes",
        "architecture_target": "modular-workflow-kernel",
        "workflow_id": "decision_brief_pack",
        "workflow_run_id": "run_preview_78eee6afcec1f12a",
        "workflow_executor_result_id": "execdry_412861ba7acffd38",
        "workflow_import_dry_run_id": "tpdry_a5678ba9e856a763",
        "source_criterion": "runtime_disabled_in_phase1",
        "dry_run_candidate_only": true,
        "taskpool_write_enabled": false,
        "requires_human_gate": false
      },
      "body_preview": "# Workflow dry-run candidate: runtime disabled in phase1\n\nThis is a taskpool import candidate generated from a workflow executor dry-run.\nIt is not a canonical brain task and must not be claimed until a separate taskpool import write gate is authorized.\n\n- Source step: `dry_step_002`\n- Source criterion: `runtime_disabled_in_phase1`\n- Boundary status: `candidate_pending`",
      "evidence": [
        "artifact:executor_dry_run:execdry_412861ba7acffd38",
        "proof:taskpool_import_dry_run_no_canonical_write",
        "classification:workflow_kernel_import_candidate"
      ],
      "write_enabled": false
    },
    {
      "candidate_id": "candidate_cdafd3c69bb1",
      "source_step_id": "dry_step_003",
      "source_criterion": "all_modules_have_model_policy",
      "title": "Workflow dry-run candidate: all modules have model policy",
      "lane": "evolution",
      "priority": "P2",
      "status_candidate": "pending",
      "frontmatter_preview": {
        "status": "pending",
        "priority": "P2",
        "lane": "evolution",
        "project": "hermes",
        "architecture_target": "modular-workflow-kernel",
        "workflow_id": "decision_brief_pack",
        "workflow_run_id": "run_preview_78eee6afcec1f12a",
        "workflow_executor_result_id": "execdry_412861ba7acffd38",
        "workflow_import_dry_run_id": "tpdry_a5678ba9e856a763",
        "source_criterion": "all_modules_have_model_policy",
        "dry_run_candidate_only": true,
        "taskpool_write_enabled": false,
        "requires_human_gate": false
      },
      "body_preview": "# Workflow dry-run candidate: all modules have model policy\n\nThis is a taskpool import candidate generated from a workflow executor dry-run.\nIt is not a canonical brain task and must not be claimed until a separate taskpool import write gate is authorized.\n\n- Source step: `dry_step_003`\n- Source criterion: `all_modules_have_model_policy`\n- Boundary status: `candidate_pending`",
      "evidence": [
        "artifact:executor_dry_run:execdry_412861ba7acffd38",
        "proof:taskpool_import_dry_run_no_canonical_write",
        "classification:workflow_kernel_import_candidate"
      ],
      "write_enabled": false
    },
    {
      "candidate_id": "candidate_39c4439266be",
      "source_step_id": "dry_step_004",
      "source_criterion": "all_modules_have_evidence_required",
      "title": "Workflow dry-run candidate: all modules have evidence required",
      "lane": "evolution",
      "priority": "P2",
      "status_candidate": "pending",
      "frontmatter_preview": {
        "status": "pending",
        "priority": "P2",
        "lane": "evolution",
        "project": "hermes",
        "architecture_target": "modular-workflow-kernel",
        "workflow_id": "decision_brief_pack",
        "workflow_run_id": "run_preview_78eee6afcec1f12a",
        "workflow_executor_result_id": "execdry_412861ba7acffd38",
        "workflow_import_dry_run_id": "tpdry_a5678ba9e856a763",
        "source_criterion": "all_modules_have_evidence_required",
        "dry_run_candidate_only": true,
        "taskpool_write_enabled": false,
        "requires_human_gate": false
      },
      "body_preview": "# Workflow dry-run candidate: all modules have evidence required\n\nThis is a taskpool import candidate generated from a workflow executor dry-run.\nIt is not a canonical brain task and must not be claimed until a separate taskpool import write gate is authorized.\n\n- Source step: `dry_step_004`\n- Source criterion: `all_modules_have_evidence_required`\n- Boundary status: `candidate_pending`",
      "evidence": [
        "artifact:executor_dry_run:execdry_412861ba7acffd38",
        "proof:taskpool_import_dry_run_no_canonical_write",
        "classification:workflow_kernel_import_candidate"
      ],
      "write_enabled": false
    },
    {
      "candidate_id": "candidate_f9cb9d798770",
      "source_step_id": "dry_step_005",
      "source_criterion": "evidence_prefixes_valid",
      "title": "Workflow dry-run candidate: evidence prefixes valid",
      "lane": "evolution",
      "priority": "P2",
      "status_candidate": "pending",
      "frontmatter_preview": {
        "status": "pending",
        "priority": "P2",
        "lane": "evolution",
        "project": "hermes",
        "architecture_target": "modular-workflow-kernel",
        "workflow_id": "decision_brief_pack",
        "workflow_run_id": "run_preview_78eee6afcec1f12a",
        "workflow_executor_result_id": "execdry_412861ba7acffd38",
        "workflow_import_dry_run_id": "tpdry_a5678ba9e856a763",
        "source_criterion": "evidence_prefixes_valid",
        "dry_run_candidate_only": true,
        "taskpool_write_enabled": false,
        "requires_human_gate": false
      },
      "body_preview": "# Workflow dry-run candidate: evidence prefixes valid\n\nThis is a taskpool import candidate generated from a workflow executor dry-run.\nIt is not a canonical brain task and must not be claimed until a separate taskpool import write gate is authorized.\n\n- Source step: `dry_step_005`\n- Source criterion: `evidence_prefixes_valid`\n- Boundary status: `candidate_pending`",
      "evidence": [
        "artifact:executor_dry_run:execdry_412861ba7acffd38",
        "proof:taskpool_import_dry_run_no_canonical_write",
        "classification:workflow_kernel_import_candidate"
      ],
      "write_enabled": false
    },
    {
      "candidate_id": "candidate_454227a3c46e",
      "source_step_id": "dry_step_006",
      "source_criterion": "human_gate_packet_fields_present",
      "title": "Workflow dry-run candidate: human gate packet fields present",
      "lane": "evolution",
      "priority": "P2",
      "status_candidate": "pending",
      "frontmatter_preview": {
        "status": "pending",
        "priority": "P2",
        "lane": "evolution",
        "project": "hermes",
        "architecture_target": "modular-workflow-kernel",
        "workflow_id": "decision_brief_pack",
        "workflow_run_id": "run_preview_78eee6afcec1f12a",
        "workflow_executor_result_id": "execdry_412861ba7acffd38",
        "workflow_import_dry_run_id": "tpdry_a5678ba9e856a763",
        "source_criterion": "human_gate_packet_fields_present",
        "dry_run_candidate_only": true,
        "taskpool_write_enabled": false,
        "requires_human_gate": false
      },
      "body_preview": "# Workflow dry-run candidate: human gate packet fields present\n\nThis is a taskpool import candidate generated from a workflow executor dry-run.\nIt is not a canonical brain task and must not be claimed until a separate taskpool import write gate is authorized.\n\n- Source step: `dry_step_006`\n- Source criterion: `human_gate_packet_fields_present`\n- Boundary status: `candidate_pending`",
      "evidence": [
        "artifact:executor_dry_run:execdry_412861ba7acffd38",
        "proof:taskpool_import_dry_run_no_canonical_write",
        "classification:workflow_kernel_import_candidate"
      ],